{
  "created_at": "2026-10-25T21:59:32.108980+00:00",
  "encoding_model": "structured_text_only",
  "record_count": 542,
  "record_type_counts": {
    "evidence_unit": 442,
    "knowledge_card": 81,
    "synthesis_card": 19
  },
  "records_path": "runs\\lake_powell_20261025_kb\\05_indexing\\encoded_knowledge_records.jsonl",
  "encoding_status": "index_ready_text_records"
}
